{
  "as_of": "2026-03-02T02:20:00Z",
  "summary": "The nightly export failed at 02:09 when its spool volume filled (log:worker-01/0a1b2c3d). The release deployed at 01:00 stopped cleaning temporary files (jk:report-export#57), which is the leading cause.",
  "impact": {
    "business_service": "Reporting",
    "cis": ["report-exporter", "worker-01"],
    "priority": {"suggested": "P3", "impact": "medium", "urgency": "low"},
    "assignment_group": "Reporting Engineering",
    "oncall": "unknown",
    "customer": "Last night's reports were not delivered; nothing else is affected."
  },
  "hypotheses": [
    {
      "id": "h-release",
      "statement": "The 01:00 release stopped cleaning temporary files, so the run filled the spool volume.",
      "role": "cause",
      "status": "leading",
      "subject": "report-exporter",
      "entities": ["report-exporter", "worker-01"],
      "changes": ["jk:report-export#57"],
      "confidence": 0.65,
      "support": ["log:worker-01/0a1b2c3d", "jk:report-export#57", "jk:report-export#56"],
      "against": [],
      "source": "derived",
      "history": [{"as_of": "2026-03-02T02:20:00Z", "status": "leading", "confidence": 0.65, "because": ["jk:report-export#57"]}]
    },
    {
      "id": "h-disk-hw",
      "statement": "The disk is failing.",
      "role": "cause",
      "status": "rejected",
      "subject": "worker-01",
      "entities": ["worker-01"],
      "changes": [],
      "confidence": 0.1,
      "support": ["slack:ops/1a2b3c4d"],
      "against": ["q:7c1d02aa"],
      "source": "stated",
      "history": [{"as_of": "2026-03-02T02:20:00Z", "status": "rejected", "confidence": 0.1, "because": ["q:7c1d02aa"]}]
    }
  ],
  "timeline": [
    {"t_utc": "2026-03-02T01:00:00Z", "event": "The new release was deployed.", "evidence": ["jk:report-export#57"]},
    {"t_utc": "2026-03-02T02:09:00Z", "event": "The run failed with no space left on the device.", "evidence": ["log:worker-01/0a1b2c3d"]}
  ],
  "actions": [
    {"rank": 1, "action": "Clear the exporter's temporary folder while no job runs.", "owner": "Reporting Engineering", "evidence": ["conf:RB-DISK-SPACE"]}
  ],
  "do_not": [
    {"action": "Do not replace the disk.", "why": "Usage rose only during the run and nothing reports a device error.", "evidence": ["q:7c1d02aa"]}
  ],
  "alerts": [
    {"handle": "dd:ev1000000001", "verdict": "this_incident"},
    {"handle": "dd:ev1000000002", "verdict": "noise"},
    {"handle": "sw:101", "verdict": "unassessed"}
  ],
  "open_questions": ["Did any other job on the same host fail after 02:09?"],
  "stakeholder_update": {
    "status": "Investigating; the cause is likely identified.",
    "customer_impact": "Last night's reports were not delivered.",
    "scope": "The nightly export only.",
    "changed_since_last": "First update.",
    "next_steps": "Clear the temporary folder and rerun the export.",
    "next_update_at": "2026-03-02T02:50:00Z"
  },
  "proposed_actions": [
    {
      "call_id": "call_11",
      "tool": "propose_action",
      "args": {"kind": "rollback", "target": "report-exporter", "params": [{"name": "to_version", "value": "2.4.0"}], "evidence": ["jk:report-export#57"]},
      "rationale": {"tests": "h-release", "expect": "The next run cleans up after itself."},
      "decision": "rejected",
      "by": {"who": "human", "via": "cli"},
      "reason": "ic:note/1c9e44d2",
      "decided_at": "2026-03-02T02:18:30Z"
    }
  ],
  "validation": {"ok": true, "attempts": 1, "dropped": [], "flagged": [], "continuity": null}
}
