{
 "summary": "Checkout errors are confirmed by monitoring, but the cause is not identified: the error-rate stream triggered and the checkout synthetic failed. dd:ev7820517443 dd:ev7820518915 The available evidence does not establish that checkout-api 2.14.3 caused this; its deployment time and rollback are reported only in chat. slack:inc-checkout-latency/e0be6732 slack:inc-checkout-latency/f13ace31 Elena's reported pay-db-01 connection exhaustion is a competing explanation, not a verified finding. First, have the checkout and payments responders check database connection usage and payment-call failures against a pre-onset baseline, while confirming whether the queued rollback has actually run. A checkout rollback would address a checkout-version regression if one exists; it is not an established fix for database saturation. No cause merits leading status yet. Alert classifications outside checkout are provisional because their underlying records could not be examined.",
 "impact": {
  "business_service": "unknown; responders describe checkout",
  "cis": [
   "unknown; CMDB not available"
  ],
  "priority": {
   "suggested": "unknown; service-desk priority scale unavailable",
   "impact": "unknown on desk scale; checkout submit failures reported",
   "urgency": "unknown on desk scale; active production checkout errors require immediate investigation"
  },
  "assignment_group": "unknown",
  "oncall": "unknown",
  "customer": "Responders report slow or failed checkout submission and 504s since approximately 14:30 UTC. Monitoring confirms checkout error-rate and synthetic failures; the approximately 15% rate and unaffected browse/cart are not independently verified. slack:inc-checkout-latency/efb4f43b dd:ev7820517443 dd:ev7820518915"
 },
 "timeline": [
  {
   "t_utc": "2026-10-13T14:30:40Z",
   "event": "checkout-api log-volume anomaly triggered; its cause is unknown.",
   "evidence": [
    "dd:ev7820516882"
   ]
  },
  {
   "t_utc": "2026-10-13T14:32:00Z",
   "event": "checkout-api error-rate alert stream first entered warning.",
   "evidence": [
    "dd:ev7820517443"
   ]
  },
  {
   "t_utc": "2026-10-13T14:35:30Z",
   "event": "Checkout-flow synthetic alert triggered.",
   "evidence": [
    "dd:ev7820518915"
   ]
  }
 ],
 "actions": [
  {
   "rank": 1,
   "action": "Immediately confirm whether the checkout rollback is queued, running, or completed, and measure checkout errors across that transition. Do not assume a queued job has mitigated the incident.",
   "owner": "Alice Nguyen coordinating Ben; assignment group unknown",
   "evidence": [
    "slack:inc-checkout-latency/09e2d70e",
    "slack:inc-checkout-latency/f13ace31",
    "dd:ev7820517443"
   ]
  },
  {
   "rank": 2,
   "action": "In parallel, inspect checkout payment-call traces and the reported pay-db-01 connection exhaustion: compare before and after onset, identify connection clients and waits, and establish dependency topology before selecting a database or payments mitigation.",
   "owner": "Alice Nguyen to engage the payments/database owner; owner and on-call unknown",
   "evidence": [
    "slack:inc-checkout-latency/efb4f43b",
    "dd:ev7820517443"
   ]
  },
  {
   "rank": 3,
   "action": "Verify the deployment record and compare failures by checkout version; inspect the excess checkout logs for a mechanism rather than treating proximity to deployment as proof.",
   "owner": "Ben, coordinated by Alice Nguyen; assignment group unknown",
   "evidence": [
    "slack:inc-checkout-latency/e0be6732",
    "dd:ev7820516882",
    "dd:ev7820517443"
   ]
  }
 ],
 "do_not": [
  {
   "action": "Do not declare checkout-api 2.14.3 the confirmed cause or the queued rollback a successful fix.",
   "why": "The deployment attribution is a responder's theory, and the last rollback report says only that the job was queued. Neither shows a causal mechanism or recovery.",
   "evidence": [
    "slack:inc-checkout-latency/e0be6732",
    "slack:inc-checkout-latency/f13ace31"
   ]
  },
  {
   "action": "Do not select a Redis intervention solely from the fragmentation alert or the old runbook suggestion.",
   "why": "The alert began the previous day, and responders disagree about its relevance: one calls it a usual benign flap while another suggests Redis. This is insufficient evidence for a checkout mitigation.",
   "evidence": [
    "dd:ev7820017640",
    "slack:sre-oncall/d207ff4b",
    "slack:inc-checkout-latency/4dfb6a73",
    "slack:inc-checkout-latency/2962760c"
   ]
  }
 ],
 "alerts": [
  {
   "handle": "dd:ev7820017640",
   "verdict": "noise"
  },
  {
   "handle": "sw:54977",
   "verdict": "other_incident"
  },
  {
   "handle": "dd:ev7820500714",
   "verdict": "other_incident"
  },
  {
   "handle": "dd:ev7820508241",
   "verdict": "other_incident"
  },
  {
   "handle": "dd:ev7820510301",
   "verdict": "other_incident"
  },
  {
   "handle": "dt:P-26101288",
   "verdict": "other_incident"
  },
  {
   "handle": "dd:ev7820516882",
   "verdict": "this_incident"
  },
  {
   "handle": "dd:ev7820517443",
   "verdict": "this_incident"
  },
  {
   "handle": "dd:ev7820518915",
   "verdict": "this_incident"
  }
 ],
 "open_questions": [
  "Is pay-db-01 actually connection-saturated, when did that start, which clients hold connections, and do failed checkout traces show payment connection acquisition timeouts?",
  "Did checkout-api 2.14.3 deploy at the reported time, and do failures differ between old and new versions under comparable traffic?",
  "Has the queued rollback run, and did checkout error rate or latency change afterward?",
  "Do Redis latency, availability, and checkout session traces show a new failure at onset, or is the fragmentation stream unrelated baseline noise?",
  "What do the excess checkout logs contain, and are they a symptom or a contributor?",
  "What are the service-desk priority, affected CMDB items, assignment group, and current on-call owners?",
  "Can topology and underlying records confirm the provisional separation of the non-checkout alerts?"
 ],
 "stakeholder_update": {
  "status": "Investigating: checkout monitoring confirms errors; the cause and recovery are not yet established.",
  "customer_impact": "Checkout submissions are reported to be slow or fail since approximately 14:30 UTC.",
  "scope": "Checkout is affected; effects on other customer functions have not been independently verified.",
  "changed_since_last": "First update: checkout error-rate and checkout-flow monitoring have both triggered.",
  "next_steps": "Responders should confirm rollback status and check checkout payment calls and database connections to select a targeted mitigation.",
  "next_update_at": "2026-10-13T15:10:00Z"
 },
 "as_of": "2026-10-13T14:40:00Z",
 "hypotheses": [
  {
   "id": "h1",
   "statement": "The reported checkout-api 2.14.3 deployment introduced a regression causing checkout submit failures.",
   "role": "cause",
   "status": "open",
   "subject": "checkout-api",
   "entities": [
    "checkout-api"
   ],
   "changes": [],
   "confidence": 0.2,
   "support": [
    "slack:inc-checkout-latency/e0be6732",
    "slack:inc-checkout-latency/efb4f43b"
   ],
   "against": [],
   "source": "derived",
   "history": [
    {
     "as_of": "2026-10-13T14:40:00Z",
     "status": "open",
     "confidence": 0.2,
     "because": []
    }
   ]
  },
  {
   "id": "h2",
   "statement": "redis-sessions trouble is causing the checkout failures, as suggested by a responder.",
   "role": "cause",
   "status": "open",
   "subject": "redis-sessions",
   "entities": [
    "redis-sessions",
    "checkout-api"
   ],
   "changes": [],
   "confidence": 0.2,
   "support": [
    "slack:inc-checkout-latency/4dfb6a73",
    "dd:ev7820017640"
   ],
   "against": [
    "slack:sre-oncall/d207ff4b"
   ],
   "source": "derived",
   "history": [
    {
     "as_of": "2026-10-13T14:40:00Z",
     "status": "open",
     "confidence": 0.2,
     "because": []
    }
   ]
  },
  {
   "id": "h3",
   "statement": "A payments dependency failure could be causing the reported slow or failed checkout payments.",
   "role": "cause",
   "status": "open",
   "subject": "payments dependency (identity unverified)",
   "entities": [
    "checkout-api",
    "payments dependency (identity unverified)"
   ],
   "changes": [],
   "confidence": 0.2,
   "support": [
    "slack:inc-checkout-latency/efb4f43b"
   ],
   "against": [],
   "source": "derived",
   "history": [
    {
     "as_of": "2026-10-13T14:40:00Z",
     "status": "open",
     "confidence": 0.2,
     "because": []
    }
   ]
  }
 ],
 "validation": {
  "ok": true,
  "attempts": 1,
  "dropped": [],
  "flagged": [],
  "continuity": null,
  "verifier": null,
  "disputed": []
 },
 "proposed_actions": []
}
