{
 "summary": "Checkout errors are confirmed by monitoring, but the cause is not established. The available evidence does not confirm that checkout-api 2.14.3 caused them: the deploy time and rollback theory come from Ben's chat, not a deployment record. A rollback would target that suspected regression; there is no evidence yet that it would relieve the reported payment-database connection saturation. First, ask Alice to review the queued rollback decision while responders check payment connection ownership and compare failures across checkout versions. Checkout's log-volume alert began at 14:30:40, followed by its error-rate alert at 14:32 and checkout synthetic failure at 14:35:30. dd:ev7820516882 dd:ev7820517443 dd:ev7820518915 The database theory is also unverified: no database metrics, logs, topology or connection records were available. Ben reported the rollback queued, not completed. slack:inc-checkout-latency/e0be6732 slack:inc-checkout-latency/f13ace31",
 "impact": {
  "business_service": "unknown from service-desk records; PagerDuty chat names Checkout - Prod",
  "cis": [
   "unknown from CMDB; monitoring identifies service:checkout-api"
  ],
  "priority": {
   "suggested": "unknown on the service desk's scale; urgent customer-facing incident",
   "impact": "unknown on desk scale; checkout failures confirmed, affected customer count unknown",
   "urgency": "unknown on desk scale; active checkout errors need immediate investigation"
  },
  "assignment_group": "unknown",
  "oncall": "unknown",
  "customer": "Checkout submit is reported slow or returning 504s since approximately 14:30; checkout error and synthetic alerts corroborate a checkout problem. The reported approximately 15% error rate and unaffected browse/cart have not been independently checked."
 },
 "timeline": [
  {
   "t_utc": "2026-10-13T14:30:40Z",
   "event": "checkout-api log-volume anomaly monitor triggered.",
   "evidence": [
    "dd:ev7820516882"
   ]
  },
  {
   "t_utc": "2026-10-13T14:32:00Z",
   "event": "checkout-api error-rate monitor first warned; the stream records a triggered state by 14:33.",
   "evidence": [
    "dd:ev7820517443"
   ]
  },
  {
   "t_utc": "2026-10-13T14:35:30Z",
   "event": "Checkout-flow synthetic monitor triggered.",
   "evidence": [
    "dd:ev7820518915"
   ]
  }
 ],
 "actions": [
  {
   "rank": 1,
   "action": "Ask Alice Nguyen to review whether to pause the queued checkout-api rollback pending a rapid discriminating check; it has been reported queued, and deployment causality is still only a responder theory. This is a recommendation, not a cancellation of her authorization.",
   "owner": "Alice Nguyen",
   "evidence": [
    "slack:inc-checkout-latency/09e2d70e",
    "slack:inc-checkout-latency/f13ace31",
    "slack:inc-checkout-latency/e0be6732"
   ]
  },
  {
   "rank": 2,
   "action": "Obtain a pre-onset baseline and current checkout traces, grouped by deployed version and downstream failure, to distinguish a checkout regression from a dependency failure.",
   "owner": "Ben (benk), with Sam; formal assignment group unknown",
   "evidence": [
    "slack:inc-checkout-latency/e0be6732",
    "slack:inc-checkout-latency/695d29e7",
    "dd:ev7820517443"
   ]
  },
  {
   "rank": 3,
   "action": "Have Alice engage the payment/database owner to verify the reported pay-db-01 connection saturation, identify connection clients and recent changes, and select a reversible mitigation only if that mechanism is confirmed.",
   "owner": "Alice Nguyen; payment/database owner unknown",
   "evidence": [
    "slack:inc-checkout-latency/efb4f43b",
    "dd:ev7820517443"
   ]
  },
  {
   "rank": 4,
   "action": "After any mitigation, verify recovery using checkout error rate and checkout-flow synthetics, not just pod health, before declaring resolution.",
   "owner": "Alice Nguyen with Sam",
   "evidence": [
    "dd:ev7820517443",
    "dd:ev7820518915",
    "slack:inc-checkout-latency/f13ace31"
   ]
  }
 ],
 "do_not": [
  {
   "action": "Do not treat the queued rollback as a completed or successful mitigation.",
   "why": "The only execution update says the job is queued; there is no completion or recovery evidence.",
   "evidence": [
    "slack:inc-checkout-latency/f13ace31"
   ]
  },
  {
   "action": "Do not make a Redis change solely because the fragmentation alert is active or the old runbook names Redis.",
   "why": "That alert first fired the previous day, and responders describe it as a usual benign flap and question the runbook's currency. These are reasons to check Redis rather than assume it is the cause, not proof that Redis is healthy.",
   "evidence": [
    "dd:ev7820017640",
    "slack:sre-oncall/d207ff4b",
    "slack:inc-checkout-latency/2962760c"
   ]
  },
  {
   "action": "Do not use healthy checkout pods to declare checkout healthy.",
   "why": "Ben reports healthy pods while checkout error and synthetic monitors show a customer-path problem.",
   "evidence": [
    "slack:inc-checkout-latency/f13ace31",
    "dd:ev7820517443",
    "dd:ev7820518915"
   ]
  }
 ],
 "alerts": [
  {
   "handle": "dd:ev7820017640",
   "verdict": "noise"
  },
  {
   "handle": "sw:54977",
   "verdict": "other_incident"
  },
  {
   "handle": "dd:ev7820500714",
   "verdict": "other_incident"
  },
  {
   "handle": "dd:ev7820508241",
   "verdict": "other_incident"
  },
  {
   "handle": "dd:ev7820510301",
   "verdict": "other_incident"
  },
  {
   "handle": "dt:P-26101288",
   "verdict": "other_incident"
  },
  {
   "handle": "dd:ev7820516882",
   "verdict": "this_incident"
  },
  {
   "handle": "dd:ev7820517443",
   "verdict": "this_incident"
  },
  {
   "handle": "dd:ev7820518915",
   "verdict": "this_incident"
  }
 ],
 "open_questions": [
  "Do deployment records and version-split traces show failures confined to 2.14.3, with a healthy pre-deploy baseline, or failures across versions? This would decide h1.",
  "Do database connection metrics and client/session records confirm pay-db-01 saturation before checkout failures, and do traces show checkout waiting on that dependency? The error alert cited for h2 establishes only the symptom, not its database mechanism.",
  "Do Redis latency, errors and checkout traces show a new Redis failure at onset? This would decide h3; its existing fragmentation alert alone does not.",
  "Has the rollback actually started or completed, and has checkout behavior changed?",
  "Who owns checkout, payments and pay-db-01, who is on call, and what priority and scope does INC0048811 record?",
  "Are browse and cart unaffected, and what is the measured checkout error rate and affected customer population?",
  "Are the other alert streams truly separate? Their verdicts are provisional: Redis noise classification rests on responder testimony, and no topology or detailed records were available to establish independence of the remaining alerts."
 ],
 "stakeholder_update": {
  "status": "Investigating: checkout error and checkout-flow monitoring show an active problem; the cause is not yet confirmed.",
  "customer_impact": "Checkout submit is reported slow or failing since approximately 14:30 UTC.",
  "scope": "Checkout is affected; wider scope and unaffected paths have not been independently verified.",
  "changed_since_last": "First update: checkout monitoring confirms the reported problem, but does not establish its cause.",
  "next_steps": "Responders should distinguish a checkout release problem from a payment dependency problem and verify the status of the queued rollback.",
  "next_update_at": "2026-10-13T15:10:00Z"
 },
 "as_of": "2026-10-13T14:40:00Z",
 "hypotheses": [
  {
   "id": "h1",
   "statement": "The reported checkout-api 2.14.3 deployment introduced a regression that caused checkout failures.",
   "role": "cause",
   "status": "open",
   "subject": "checkout-api",
   "entities": [
    "checkout-api"
   ],
   "changes": [],
   "confidence": 0.2,
   "support": [
    "slack:inc-checkout-latency/e0be6732",
    "dd:ev7820517443"
   ],
   "against": [],
   "source": "derived",
   "history": [
    {
     "as_of": "2026-10-13T14:40:00Z",
     "status": "open",
     "confidence": 0.2,
     "because": []
    }
   ]
  },
  {
   "id": "h2",
   "statement": "The reported pay-db-01 connection saturation caused checkout failures through the payments dependency; this remains an untested explanation of the observed errors.",
   "role": "cause",
   "status": "open",
   "subject": "pay-db-01",
   "entities": [
    "pay-db-01",
    "payments gateway",
    "checkout-api"
   ],
   "changes": [],
   "confidence": 0.2,
   "support": [
    "dd:ev7820517443"
   ],
   "against": [],
   "source": "derived",
   "history": [
    {
     "as_of": "2026-10-13T14:40:00Z",
     "status": "open",
     "confidence": 0.2,
     "because": []
    }
   ]
  },
  {
   "id": "h3",
   "statement": "A redis-sessions fault caused the checkout failures, as suggested in responder chat.",
   "role": "cause",
   "status": "open",
   "subject": "redis-sessions",
   "entities": [
    "redis-sessions",
    "checkout-api"
   ],
   "changes": [],
   "confidence": 0.2,
   "support": [
    "slack:inc-checkout-latency/4dfb6a73",
    "dd:ev7820017640"
   ],
   "against": [
    "slack:sre-oncall/d207ff4b"
   ],
   "source": "derived",
   "history": [
    {
     "as_of": "2026-10-13T14:40:00Z",
     "status": "open",
     "confidence": 0.2,
     "because": []
    }
   ]
  }
 ],
 "validation": {
  "ok": true,
  "attempts": 1,
  "dropped": [],
  "flagged": [],
  "continuity": null,
  "verifier": null,
  "disputed": []
 },
 "proposed_actions": []
}
